{
  "schema_version": "1.0",
  "job_id": "job-web-c3e382183000",
  "cases": [
    {
      "id": "TC-001",
      "interface_id": "IF-REST-001",
      "category": "normal",
      "title": "用户登录正常流程：admin 凭据校验通过返回 token",
      "expected": "status=200；响应体包含非空 token 与 username=admin",
      "requirement_id": "REQ-001",
      "params": {
        "body": {
          "username": "admin",
          "password": "***"
        }
      },
      "auth_mode": "inherit",
      "low_confidence": true,
      "script_path": "scripts/test_TC_001.py",
      "loadable": true
    },
    {
      "id": "TC-002",
      "interface_id": "IF-REST-001",
      "category": "exception",
      "title": "登录失败-用户名或密码错误返回 HTTP 401",
      "expected": "status=401；响应提示\"用户名或密码错误\"",
      "requirement_id": "REQ-090",
      "params": {
        "body": {
          "username": "admin",
          "password": "***"
        }
      },
      "auth_mode": "inherit",
      "low_confidence": true,
      "script_path": "scripts/test_TC_002.py",
      "loadable": true
    },
    {
      "id": "TC-003",
      "interface_id": "IF-REST-001",
      "category": "boundary",
      "title": "登录入参边界-用户名为空触发校验拒绝",
      "expected": "status_class=4xx；响应提示请输入用户名",
      "requirement_id": "REQ-091",
      "params": {
        "body": {
          "username": "",
          "password": "***"
        }
      },
      "auth_mode": "inherit",
      "low_confidence": true,
      "script_path": "scripts/test_TC_003.py",
      "loadable": true
    },
    {
      "id": "TC-004",
      "interface_id": "IF-REST-001",
      "category": "exception",
      "title": "登录异常-Session/Token 失效返回 HTTP 401",
      "expected": "status=401；前端拦截器捕获后重定向至登录页",
      "requirement_id": "REQ-092",
      "params": {
        "body": {
          "username": "admin",
          "password": "***"
        }
      },
      "auth_mode": "invalid",
      "low_confidence": true,
      "script_path": "scripts/test_TC_004.py",
      "loadable": true
    },
    {
      "id": "TC-005",
      "interface_id": "IF-REST-001",
      "category": "exception",
      "title": "登录异常-连续 5 次失败账号锁定 15 分钟",
      "expected": "status_class=4xx；响应提示\"账号已锁定，请 15 分钟后重试\"",
      "requirement_id": "REQ-093",
      "params": {
        "body": {
          "username": "admin",
          "password": "***"
        }
      },
      "auth_mode": "inherit",
      "low_confidence": true,
      "script_path": "scripts/test_TC_005.py",
      "loadable": true
    },
    {
      "id": "TC-006",
      "interface_id": "IF-REST-001",
      "category": "boundary",
      "title": "登录入参边界-密码超长（>1024 字符）触发校验拒绝",
      "expected": "status_class=4xx；响应提示字段长度超限",
      "requirement_id": "REQ-121",
      "params": {
        "body": {
          "username": "admin",
          "password": "***"
        }
      },
      "auth_mode": "inherit",
      "low_confidence": true,
      "script_path": "scripts/test_TC_006.py",
      "loadable": true
    },
    {
      "id": "TC-007",
      "interface_id": "IF-REST-002",
      "category": "normal",
      "title": "用户已登录状态正常登出返回成功消息",
      "expected": "status=200；响应 message 表示登出成功",
      "requirement_id": "REQ-122",
      "params": {
        "body": {}
      },
      "auth_mode": "inherit",
      "low_confidence": true,
      "script_path": "scripts/test_TC_007.py",
      "loadable": true
    },
    {
      "id": "TC-008",
      "interface_id": "IF-REST-002",
      "category": "exception",
      "title": "登出异常-未携带 Token 返回 HTTP 401",
      "expected": "status=401；响应表示会话缺失",
      "requirement_id": "REQ-122",
      "params": {
        "body": {}
      },
      "auth_mode": "missing",
      "low_confidence": true,
      "script_path": "scripts/test_TC_008.py",
      "loadable": true
    },
    {
      "id": "TC-009",
      "interface_id": "IF-REST-002",
      "category": "exception",
      "title": "登出异常-伪造/过期 Token 返回 HTTP 401",
      "expected": "status=401；会话无效被拒绝",
      "requirement_id": "REQ-122",
      "params": {
        "body": {}
      },
      "auth_mode": "invalid",
      "low_confidence": true,
      "script_path": "scripts/test_TC_009.py",
      "loadable": true
    },
    {
      "id": "TC-010",
      "interface_id": "IF-REST-003",
      "category": "normal",
      "title": "已登录用户获取自身资料返回用户信息",
      "expected": "status=200；响应包含当前登录用户的 username/user_info",
      "auth_mode": "inherit",
      "script_path": "scripts/test_TC_010.py",
      "loadable": true
    },
    {
      "id": "TC-011",
      "interface_id": "IF-REST-003",
      "category": "exception",
      "title": "获取当前用户-未携带 Token 返回 HTTP 401",
      "expected": "status=401；需跳转登录页",
      "auth_mode": "missing",
      "script_path": "scripts/test_TC_011.py",
      "loadable": true
    },
    {
      "id": "TC-012",
      "interface_id": "IF-REST-003",
      "category": "exception",
      "title": "获取当前用户-伪造/过期 Token 返回 HTTP 401",
      "expected": "status=401；会话无效",
      "auth_mode": "invalid",
      "script_path": "scripts/test_TC_012.py",
      "loadable": true
    },
    {
      "id": "TC-013",
      "interface_id": "IF-REST-004",
      "category": "normal",
      "title": "个人开户正常流程：写入 ACCOUNT 并返回交易账号",
      "expected": "status=201；响应 transaction_account_id 非空",
      "requirement_id": "REQ-018",
      "params": {
        "body": {
          "investor_name": "张三",
          "id_type": "0",
          "id_no": "11010519491231002X",
          "cellphone": "13800138000"
        }
      },
      "auth_mode": "inherit",
      "low_confidence": true,
      "script_path": "scripts/test_TC_013.py",
      "loadable": true
    },
    {
      "id": "TC-014",
      "interface_id": "IF-REST-004",
      "category": "exception",
      "title": "开户异常-证件类型非法拒绝提交",
      "expected": "status=400；响应提示\"个人证件类型不合法\"",
      "requirement_id": "REQ-099",
      "params": {
        "body": {
          "investor_name": "张三",
          "id_type": "9",
          "id_no": "11010519491231002X",
          "cellphone": "13800138000"
        }
      },
      "auth_mode": "inherit",
      "low_confidence": true,
      "script_path": "scripts/test_TC_014.py",
      "loadable": true
    },
    {
      "id": "TC-015",
      "interface_id": "IF-REST-004",
      "category": "boundary",
      "title": "开户异常-投资者名称超长（121 字符）拒绝提交",
      "expected": "status=400；响应提示\"字段长度超限\"",
      "requirement_id": "REQ-102",
      "params": {
        "body": {
          "investor_name": "名名名名名名名名名名名名名名名名名名名名名名名名名名名名名名名名名名名名名名名名名名名名名名名名名名名名名名名名名名名名名名名名名名名名名名名名名名名名名名名名名名名名名名名名名名名名名名名名名名名名名名名名名名名名名名名名名名名名名名名名名名名名",
          "id_type": "0",
          "id_no": "11010519491231002X",
          "cellphone": "13800138000"
        }
      },
      "auth_mode": "inherit",
      "low_confidence": true,
      "script_path": "scripts/test_TC_015.py",
      "loadable": true
    },
    {
      "id": "TC-016",
      "interface_id": "IF-REST-004",
      "category": "exception",
      "title": "开户异常-证件号已开户返回 HTTP 400",
      "expected": "status=400；响应提示\"该证件号已开户\"",
      "requirement_id": "REQ-103",
      "params": {
        "body": {
          "investor_name": "李四",
          "id_type": "0",
          "id_no": "11010519491231002X",
          "cellphone": "13800138001"
        }
      },
      "auth_mode": "inherit",
      "low_confidence": true,
      "script_path": "scripts/test_TC_016.py",
      "loadable": true
    },
    {
      "id": "TC-017",
      "interface_id": "IF-REST-004",
      "category": "exception",
      "title": "开户异常-手机号格式错误（含非数字）拒绝提交",
      "expected": "status=400；响应提示\"手机号格式错误\"",
      "requirement_id": "REQ-101",
      "params": {
        "body": {
          "investor_name": "王五",
          "id_type": "0",
          "id_no": "11010519800101003X",
          "cellphone": "1380013800a"
        }
      },
      "auth_mode": "inherit",
      "low_confidence": true,
      "script_path": "scripts/test_TC_017.py",
      "loadable": true
    },
    {
      "id": "TC-018",
      "interface_id": "IF-REST-005",
      "category": "normal",
      "title": "修改客户资料正常流程：更新投资者名称",
      "expected": "status=200；响应体现更新后的账户详情",
      "requirement_id": "REQ-079",
      "params": {
        "pk": "1001",
        "body": {
          "investor_name": "张三（更名）"
        }
      },
      "auth_mode": "inherit",
      "low_confidence": true,
      "script_path": "scripts/test_TC_018.py",
      "loadable": true
    },
    {
      "id": "TC-019",
      "interface_id": "IF-REST-005",
      "category": "exception",
      "title": "修改客户资料-不存在的主键返回 HTTP 404",
      "expected": "status=404；响应表示账户不存在",
      "requirement_id": "REQ-079",
      "params": {
        "pk": "999999999",
        "body": {
          "investor_name": "不存在"
        }
      },
      "auth_mode": "inherit",
      "low_confidence": true,
      "script_path": "scripts/test_TC_019.py",
      "loadable": true
    },
    {
      "id": "TC-020",
      "interface_id": "IF-REST-005",
      "category": "boundary",
      "title": "修改客户资料-请求体为空触发校验拒绝",
      "expected": "status_class=4xx；响应提示无可更新字段",
      "requirement_id": "REQ-079",
      "params": {
        "pk": "1001",
        "body": {}
      },
      "auth_mode": "inherit",
      "low_confidence": true,
      "script_path": "scripts/test_TC_020.py",
      "loadable": true
    },
    {
      "id": "TC-021",
      "interface_id": "IF-REST-006",
      "category": "normal",
      "title": "账户销户正常流程：成功关闭指定账户",
      "expected": "status=200；响应表示销户成功",
      "requirement_id": "REQ-078",
      "params": {
        "pk": "1001",
        "body": {}
      },
      "auth_mode": "inherit",
      "low_confidence": true,
      "script_path": "scripts/test_TC_021.py",
      "loadable": true
    },
    {
      "id": "TC-022",
      "interface_id": "IF-REST-006",
      "category": "exception",
      "title": "账户销户-不存在的主键返回 HTTP 404",
      "expected": "status=404；响应表示账户不存在",
      "requirement_id": "REQ-078",
      "params": {
        "pk": "999999999",
        "body": {}
      },
      "auth_mode": "inherit",